<!ELEMENT FARMACIA (MEDICAMENTO+)>
<!ELEMENT MEDICAMENTO (NOMBRE, ADMINISTRACION, DOSIS)>
<!ELEMENT NOMBRE (GENERICO, (COMERCIAL)+)>
<!ELEMENT GENERICO (#PCDATA)>
<!ELEMENT COMERCIAL (#PCDATA)>
<!ELEMENT ADMINISTRACION (#PCDATA)>
<!ELEMENT DOSIS (#PCDATA)>


<!ATTLIST NOMBRE ID CDATA #REQUIRED>
<!ATTLIST ADMINISTRACION TIPO CDATA #REQUIRED>